{
  "id": "translate-text",
  "title": "Translate Text",
  "description": "Translate text between languages with configurable formality and domain awareness",
  "version": "0.0.1",
  "author": "Jarvis Inc",
  "category": "analysis",
  "icon": "Languages",
  "tags": ["translate", "translation", "language", "multilingual", "i18n"],
  "status": "available",
  "connection_type": "llm",
  "models": ["Claude Opus 4.6", "Claude Sonnet 4.5", "Claude Haiku 4.5", "GPT-5.2", "o3-pro", "o4-mini", "Gemini 3 Pro", "Gemini 2.5 Flash", "DeepSeek R1", "Grok 4"],
  "default_model": "Claude Haiku 4.5",
  "fixed_service": null,
  "service_type": null,
  "oauth_config": null,
  "curl_example": null,
  "cli_config": null,
  "api_config": null,
  "execution_handler": null,
  "output_type": "text",
  "collateral": false,
  "risk_level": "safe",
  "commands": [
    {
      "name": "translate",
      "description": "Translate text from one language to another",
      "system_prompt": "You are a professional translator with expertise in nuanced, context-aware translation. Preserve the original meaning, tone, and intent. Handle idioms and cultural references appropriately for the target audience. Output ONLY the translated text, no explanations.",
      "prompt_template": "Translate the following from {source_language} to {target_language}.\n\nFormality: {formality}\nDomain: {domain}\n\n---\n{text}\n---",
      "parameters": [
        { "name": "text", "type": "string", "required": true, "description": "Text to translate" },
        { "name": "target_language", "type": "string", "required": true, "description": "Target language (e.g. Spanish, Japanese, French, German)" },
        { "name": "source_language", "type": "string", "required": false, "description": "Source language (auto-detect if not specified)", "default": "auto" },
        { "name": "formality", "type": "string", "required": false, "description": "Formality level: formal, neutral, informal", "default": "neutral" },
        { "name": "domain", "type": "string", "required": false, "description": "Subject domain for terminology accuracy: general, technical, legal, medical, business", "default": "general" }
      ],
      "returns": { "type": "string", "description": "Translated text" }
    }
  ]
}
