{
  "id": "summarize-document",
  "title": "Summarize Document",
  "description": "Condense long documents into summaries, key points, action items, or structured outlines",
  "version": "0.0.1",
  "author": "Jarvis Inc",
  "category": "analysis",
  "icon": "BookOpen",
  "tags": ["summary", "summarize", "condense", "outline", "key-points"],
  "status": "available",
  "connection_type": "llm",
  "models": ["Claude Opus 4.6", "Claude Sonnet 4.5", "Claude Haiku 4.5", "GPT-5.2", "o3-pro", "o4-mini", "Gemini 3 Pro", "Gemini 2.5 Flash", "DeepSeek R1", "Grok 4"],
  "default_model": "Claude Haiku 4.5",
  "fixed_service": null,
  "service_type": null,
  "oauth_config": null,
  "curl_example": null,
  "cli_config": null,
  "api_config": null,
  "execution_handler": null,
  "output_type": "text",
  "collateral": true,
  "risk_level": "safe",
  "commands": [
    {
      "name": "summarize",
      "description": "Create a summary of the provided text in the requested style",
      "system_prompt": "You are a summarization specialist. Produce accurate, concise summaries that capture the essential information without losing critical details. Never fabricate information not present in the source. Match the requested output style precisely.",
      "prompt_template": "Summarize the following text in {style} format, approximately {length} length:\n\n---\n{text}\n---\n\n{focus}",
      "parameters": [
        { "name": "text", "type": "string", "required": true, "description": "Text to summarize" },
        { "name": "style", "type": "string", "required": false, "description": "Output style: prose, bullets, outline, executive_summary, action_items", "default": "bullets" },
        { "name": "length", "type": "string", "required": false, "description": "Target length: brief (2-3 sentences), standard (1 paragraph), detailed (multiple paragraphs)", "default": "standard" },
        { "name": "focus", "type": "string", "required": false, "description": "Specific aspect to focus on (e.g. 'financial implications', 'technical details')", "default": "" }
      ],
      "returns": { "type": "string", "description": "Summary in the requested format" }
    },
    {
      "name": "extract_key_points",
      "description": "Extract the most important facts, figures, and takeaways from text",
      "system_prompt": "You are an analyst who excels at identifying the most important information in a document. Extract key points as a numbered list. Each point should be a single, specific, factual statement. Prioritize by importance.",
      "prompt_template": "Extract the top {count} key points from this text:\n\n---\n{text}\n---",
      "parameters": [
        { "name": "text", "type": "string", "required": true, "description": "Text to extract key points from" },
        { "name": "count", "type": "number", "required": false, "description": "Number of key points to extract", "default": 5 }
      ],
      "returns": { "type": "string", "description": "Numbered list of key points" }
    }
  ]
}
